Theme	Parent	Definition	Example	References
emotionless emotion craving alien	mentally distinguished life form	An alien race that, lacking emotions of their own, somehow crave to experience emotions with the help of others.		
empathic alien	mentally distinguished life form	An alien that senses the emotions of others in a telepathic manner and with high fidelity, prominently the Betazoids.	Another empathic alien, a woman named Gem, could even heal with the power of empathy in tos3x08 "The Empath".	
endangered species	contemporary social issue	Ideas surrounding the preserving of endangered species are explored.		https://en.wikipedia.org/wiki/Endangered_species
enemy point of view	views and customs	We are simultaneously shown what things may be like from the respective viewpoints of two factions that see each other as enemies.		
energy vortex entity	spaceborne life form	A sentient being composed of enormous vortex like flows of energy in space.	Such a being trapped and nearly destroyed the Enterprise-D in tng2x13 "Time Squared".	
enlightened dictatorship	social order	There is a hypothetical social order where an incorruptibly wise, just and benevolent person is invested with absolute power for life.		https://en.wikipedia.org/wiki/Benevolent_dictatorship
ennui	state of mind	Someone is feeling bored and depressed with their life and existence.	General Trelane (retired), a.k.a. the Squire of Gothos, held an enterprise landing party against their will to help spice up his life in tos1x18 "The Squire of Gothos".	https://en.wikipedia.org/wiki/Boredom
environmentalism	contemporary social issue	An ideology that emphasizes environmental protection and improvement of the health of the environment with a focus on non-human elements.		https://en.wikipedia.org/wiki/Environmentalism
epic love	romantic love	The love between idealized Earth-moving love of Gods, legends, and Helen of Troy.		
equal career opportunities for women	the battle of the sexes	The problem women have in finding the same career opportunities as men in a male dominated society is featured.	Dr. Janice Lester was convinced that Captain Kirk had had the career she had not, only because of their respective genders in tos3x24 "Turnabout Intruder".	https://en.wikipedia.org/wiki/Women_in_the_workforce
escape from reality	state of mind	Someone prefers to dream up a fantasy world rather than face reality.		https://en.wikipedia.org/wiki/Escapism
espionage	the art of war	One faction uses covert methods such as the planting of spies in order to glean secret information from an opposing faction and thus gain military or political advantage.		https://en.wikipedia.org/wiki/Espionage
ethics	philosophy	The branch of philosophy that involves systematizing, defending, and recommending moral principles.		https://en.wikipedia.org/wiki/Ethics, http://www.infobasepublishing.com/Bookdetail.aspx?ISBN=0816071616
ethnic hatred	contemporary social issue	Hostility toward an ethnic group is featured.		https://en.wikipedia.org/wiki/Ethnic_hatred
eugenics	past and present moral controversy	We are asked to what extent, if any, we should collectively strive to control human evolution by selective breeding. In past this has meant sterilizing or killing "undesirable" people, and subsidizing the procreation of "desirable" people.	Doctor Stavos Keniclius 5 made a failed bid to create a galactic master race of giant Spock clones in tas1x07 "The Infinite Vulcan" - a giant Spock, of course, being the measure of eugenic perfection.	https://en.wikipedia.org/wiki/Eugenics, http://www.sf-encyclopedia.com/entry/eugenics
euthanasia	past and present moral controversy	We are asked how and when, if ever, we should allow and assist the "merciful" killing of someone who is thought to suffer greatly without any other hope of relief.		https://en.wikipedia.org/wiki/Euthanasia
everyone escapes to a fantasy world and civilization collapses	man-made existential risk	After finding the means of satisfying their needs in a fantasy world, people simply stop trying to achieve even the minimum needed to persist.		
evil can come in the guise of beauty	life lesson	We are warned not to be deceived by beauty as attractive people (or objects) may in fact be quite as evil as anyone (or anything) else.	Miranda Jones was both smart and beautiful but under the surface she had a viciously jealous streak in tos3x07 "Is There in Truth No Beauty?". This in contrast to the Medusan ambassador who was hideous yet remarkably accommodating.	
exceedingly devious alien	culturally distinguished life form	A race of aliens defined by their abnormally devious nature, prominently the Romulans.		
exceedingly ruthless alien	culturally distinguished life form	A race of aliens defined by their abnormally ruthless nature, prominently the Cardassians.		
exercising self-restraint	introspection	Someone acknowledges their own emotions but refrains from giving them an outlet.	Riker urged Troi to exercise a modicum of self-restraint shortly after she picked up a young ensign on the turbolift in tng6x03 "Man of the People".	https://en.wikipedia.org/wiki/Self-control
existential risk	alternate society	The category of themes that are about how life on a planet (notably Earth) could come into jeopardy. An event that would destroy an entire humanoid species or irreversibly cripple its civilization so that it could not reach its full potential is posited.		
expecting parents	parenting	The lives of (typically) two soon-to-be parents between confirmed conception and the birth of a child is explored.		
experimental medical procedure	medical ethics	The question of where to draw the line when it comes to the use of experimental medical procedures is featured. Examples include when a doctor resorts to the use of such procedures on his or her patients either in the name of the advancement of medical science or as a last resort on a critically ill patient.	Dr. Toby Russell wanted to test out her new surgical procedure for spinal transplantation on Worf but Beverly remonstrated in tng5x16 "Ethics".	https://en.wikipedia.org/wiki/Category:Experimental_medical_treatments
exploitation of sentient beings	human rights	We are made to ponder what is needed for a creature to be considered sentient and when the exploitation of such a creature becomes shameful. Exploiting beasts of burden is typically condoned but the same treatment of human beings would be morally reprehensible.		
exploiting a lover	romantic relationship	Someone scrupulously takes advantage of their lovers devotion for personal gain.		
exponential growth	topic in science	A very rapid kind of growth by which the amount of a quantity increases at a rate proportional to the amount already present.		https://en.wikipedia.org/wiki/Exponential_growth
expressing feelings	one-on-one interaction	The various troubles involved in expressing one’s feelings to another are featured.	Data expressed his affection for Spot the cat in characteristic android fashion by reciting "Ode to Spot" in tng6x05 "Schisms".	
external immune system	human enhancement	A hypothetical immune system that extends outside the body, attacking potential diseases before they can even come close.	Sara Kingsley’s genetically engineered super-children had such an effective immune system that it attacked pathogens before they could even get near the body in question in tng2x07 "Unnatural Selection"; unfortunately it also attacked other people.	
extinct interstellar civilization	miscellaneous life form	A civilization that flourished to the extent that they colonized other planets, but then went extinct for some reason or another. What perils may the distant future hold in store?		
extra-dimensional alien	superior life form	Aliens said to be native to another dimension is featured. By "another dimension" it is usually meant a reality that is not reachable for us by conventional traversal of space, and that have somewhat different laws of nature.		
extradition	diplomacy	One sovereign faction gives up a prisoner to the care of another soverign faction.		https://en.wikipedia.org/wiki/Extradition
extrasensory perception	discredited scientific theory	The discredited theory that information can be received directly by the mind itself in addition to the recognized physical senses.	Elizabeth Dehner was reported to have an esper rating of 089 and an aperception quotient of 20/100 in tos1x01 "Where No Man Has Gone Before".	https://en.wikipedia.org/wiki/Extrasensory_perception, http://www.sf-encyclopedia.com/entry/esp
extraterrestrial threat	existential risk	The category of themes that suggest ways in which civilization on Earth (or some inhabited planet) could come under threat because of the actions of a life form from outside. When will the Martians invade?		
extremely religious alien	culturally distinguished life form	A race of aliens defined by their abnormally religious nature, prominently the Bajorans.		
extremism	contemporary social issue	Religious or political ideologies far outside the mainstream attitudes of society that are considered to be threatening to the established order.	Ensign Ro Laren infiltrated a group of Bajoran terrorists known as the Maquis in tng5x03 "Ensign Ro".	
face patch	human enhancement	Like an eye patch, but covering half of the face.	The "steady, reputable, and occasionally brilliant" Dr. Thomas Leighton sported a face patch in tos1x12 "The Conscience of the King".	
facing a conspiracy	facing general adversity	Someone faces a secret conspiracy that aims to produce some nefarious outcome.	Ensign Ro got herself mixed up in an elaborate conspiracy to eradicate a Bajoran terrorist cell in the eponymous episode tng5x03 "Ensign Ro".	
facing a ferocious beast	survival	Someone experiences what it is like to face a fearsome animal or some other kind of beast-like creature.	Captain Kirk was the victim of a nearly fatal mugato attack in tos2x16 "A Private Little War".	
facing a fight to the death	survival	Someone experiences what it is like to be in a fight to the death.	Spock got the better of Captain Kirk in the mother of all fights to the death in tos2x05 "Amok Time".	
facing a hostage situation	facing general adversity	Someone is involved in a hostage situation.	The Pakled held Geordi hostage in the hopes of getting some Federation goodies in exchange for the engineer in tng2x17 "Samaritan Snare".	http://tvtropes.org/pmwiki/pmwiki.php/Main/HostageSituation
facing a mortal enemy	survival	Someone faces their mortal enemy, i.e., someone who would be happy to see them dead.	Captain Picard faced the evil genius Dr. James Moriarty in tng2x03 "Elementary, Dear Data" and tng6x12 "Ship in a Bottle".	
facing a pandemic	facing general adversity	Someone tries to deal with a highly infectious disease running rampant through a population.	A weary band of space lepers had their sights set on bringing themselves, and possibly their disease, to planet Haven in tng1x11 "Haven".	https://en.wikipedia.org/wiki/Pandemic
facing a ship takeover	facing general adversity	Someone tries to deal with their vessel being space-jacked.	A ragtag band of space hippies took over the Enterprise with the intention of commandeering the vessel and taking it to the mythical planet Eden in tos3x20 "The Way to Eden".	
facing adversity	challenge in life	The category of themes that center around someone confronting something difficult that they actively endeavor to overcome. This includes matters of survival and making a self-sacrifice.		
facing an invading force	survival	Someone experiences what it is like when an invading force comes to attack them and their homeland.	The Delta Rana IV colonists faced a Husnock invading force very poorly by getting slaughtered down to the last man in tng3x03 "The Survivors".	
facing an overpowering adversary	survival	Someone learns what it is like to come up against an opponent that is many times more capable than themselves.	The future of humanity was at stake in tng4x01 "The Best of Both Worlds, Part II" when the Borg came knocking in Sector 001: Earth’s sector.	
facing general adversity	facing adversity	The category of themes that involve someone confronting something difficult that they actively endeavor to overcome, but that is not a matter or survival and does not require a self-sacrifice.		
facing life in an insane asylum	facing general adversity	Someone faces living as a patient in an insane asylum with few prospects of release.	Nefarious aliens made Riker believe he might live out his life in an insane asylum on Tilonus IV in tng6x21 "Frame of Mind"	
facing life in captivity	facing general adversity	Someone faces living as a captive with no reasonable prospect of escape.	Fivas Fajo kidnapped Data to sit the android on display in his collection of rare and unusual objects tng3x22 "The Most Toys".	
facing mysterious adversity	facing general adversity	Someone tries to deal with inexplicable and mysterious, undesirable events that threaten them.	Captain Kirk was at a loss for how to explain why everyone had disappeared from the Enterprise in tos3x17 "The Mark of Gideon".	
facing one's darker side	introspection	Someone analyzes their own less desirable attributes and inclinations.	William T. Riker saw his darker side in Thomas Riker in tng6x24 "Second Chances", but the feeling was mutual.	
facing one's darkest fear	facing general adversity	Someone comes face to face with what they fear the most.	Barclay mustered the courage to face his darkest fear of going through the transporter in tng6x02 "Realm of Fear".	
facing wrongful accusations	facing general adversity	Someone must deal with being falsely accused of a misdeed.	Scotty was falsely accused of murdering three women while on shore leave on Argelius II in tos2x07 "Wolf in the Fold".	
fairness	agreeable characteristic	A character displays the ability to make equitable judgements without prejudice or bias.		
faith in a friend	one-on-one interaction	Someone supports a friend by showing unwavering trust in their abilities.	Captain Picard decided to trust Guinan implicitly, albeit after been on the receiving end of  a stern talking to from the Ten Forward bartender, in tng3x15 "Yesterday's Enterprise".	
faith vs. reason	religion	The central question in the battle between the secular (science) and the ecclesiastical (religion): Is there a valid source of knowledge, i.e., revelation, that is not derived from reason and not subject to scientific experimentation?		https://en.wikipedia.org/wiki/Faith_and_rationality
fall out from a one night stand	romantic relationship	The various interpersonal troubles that can come after a poorly considered one night stand are illustrated. Can you remain friends?	Helen Noel reminded Captain Kirk about what happened between them when he dropped in at the science lab Christmas party in tos1x10 "Dagger of the Mind".	
falling out of friendship	one-on-one interaction	Two friends stop being friends, for example, because they come to disagree about an important issue.		
false flag operation	war	A faction that wants to make war creates an incident and blames it on the enemy. The real warmongerers can then attack while falsely claiming that their targeted enemy started the hostilities.	The Enterprise-D nearly destroyed a Lysian space station in revenge but then it turned out the whole situation had been orchestrated by the Sataarans in tng5x14 "Conundrum".	https://en.wikipedia.org/wiki/False_flag
familial love	love	The category of themes that pertain to love among family and friends.		
familial relations	family affairs	The category of themes that point to relationships between persons who are close enough to plausibly think of each other more-or-less as family.		
family affairs	social interaction	The category of themes that are about interpersonal relations and interaction within a family.		http://www.infobasepublishing.com/Bookdetail.aspx?ISBN=0816071616
fascism	social order	There is a system of authoritarian nationalism in the best traditions of Mussolini’s Italy (1922-43) or Hitler’s Third Reich (1933-45).	Federation cultural observer John Gill ill-advisedly instituted a Nazi state on the planet Ekos in tos2x23 "Patterns of Force".	https://en.wikipedia.org/wiki/Fascism
father and daughter	familial relations	The relationship between a father and his daughter is featured.		
father and son	familial relations	The relationship between a father and his son is featured.		
father and son rivalry	growing up	There is conflict between father and son in keeping with the Oedipusean tradition.	Riker settled his long-standing rivalry with his father Kyle in the anbo-jtytsu dohyo tng2x14 "The Icarus Factor".	
fatherly disappointment in a son	parenting	A son is not all that his father wishes him to be.		
fear	unpleasant emotion	Someone experiences anxiety about the near future in a way that rises above "apprehension", but is not so intense that they loose self-control and scream out in "terror". This theme is typically used when a character percieves a clear and present physical danger.	Beverly revealed her fear of heights to Captain Picard in tng7x08 "Attached".	https://en.wikipedia.org/wiki/Fear
fear for one's life	unpleasant emotion	A character is terrified because there is a chance that they may soon be killed or otherwise die.		
fear of an unknown future	unpleasant emotion	A character is afraid owing to the prospect of an uncertain and unfamiliar future.		
fear of the lord	religion	The believers sense of respect, awe and submission in front of their god.		
fear of the unknown	unpleasant emotion	A character is afraid because they have encountered something that is foreboding but unknown.		
federalism	social order	Societies with distinct political systems have come together and formed an overarching level of government that works in tandem with the individual systems.		https://en.wikipedia.org/wiki/Federalism
feeling of helplessness	state of mind	Someone feels distress at being unable to do something about a bad situation.		
feeling of unfulfillment	state of mind	Someone feels that their life lacks purpose and they are achieving nothing meaningful.		
felinoid alien	earth-life inspired life form	An alien race patterned after cats.	A race of carnivorous, feline humanoids, known as the Kzinti, were featured in tas 1x14 "The Slaver Weapon".	
female bonding	one-on-one interaction	Two mature adult women strengthen their friendship by engaging in stereotypically female bonding activities such as chit-chatting about Willaim T. Riker.	Ro found her confidant in Guinan in tng5x03 "Ensign Ro".	
female fickleness	female stereotype	A woman changes her opinions and affections suddenly and for no external reason, to the extent that the sexist stereotype is suggested.	Eleen of the Ten Tribes on Capella IV could not decide if she’d rather have McCoy as the father of her child or see him dead in tos2x03 "Friday's Child".	
female gold digging	female stereotype	A woman pursues a potential mate because of his wealth and power.		
female independence	the battle of the sexes	The woman struggle to become less dependent on others, particularly men, is featured.	Female android Rayna was perhaps oppressively tied to her father and suitor Flint in tos3x21 "Requiem for Methuselah".	https://en.wikipedia.org/wiki/Independent_woman
female jealousy	female stereotype	A woman exhibits jealousy towards other women over men or appearances.		
female need for male companionship	female stereotype	The sexist idea that women much more than men have a particular need for a life partner is featured.		http://tvtropes.org/pmwiki/pmwiki.php/Main/Clingyjealousgirl
female stereotype	gender issue	The category of themes that (correctly or incorrectly) highlight attributes that are believed to be typical of contemporary women. Many of these may be considered sexist today.		
female vanity	female stereotype	A woman shows excessive concern for her appearance.		
femininity	female stereotype	Qualities and mannerisms that are associated with the feminine sex in contemporary society are featured.		https://en.wikipedia.org/wiki/Femininity
fiancée and fiancée	familial relations	The relationship between two people engaged to be married is featured.		
fictional apparatus	novel sci-fi concept	The category of themes that feature fantastical gadgets like tractor beams and teleporters.		
fight vs. flee	personal practical dilemma	Someone must decide, in a given confrontational situation, whether the better course of action is to stay and fight or to flee (perhaps to survive to fight another day).		
filial love	familial love	The love of a child for their parent is featured. This is not used for very young children who just cling to their parents instinctively.		
film appreciation	the fine arts and the humanities	How best to appreciate films is discussed.	Edith Keeler wanted to catch a Clark Gable film with Captain Kirk in tos1x28 "The City on the Edge of Forever", but she got herself hit by a car instead.	https://en.wikipedia.org/wiki/Film_criticism
first crush	romantic relationship	A young person becomes romantically infatuated for the first time.		http://tvtropes.org/pmwiki/pmwiki.php/Main/FirstLove
first strike tactic	the art of war	Combatants decide to attack preemptively because they are convinced their opponent is about to attack.	Worf articulated this combat advice in tng2x02 "Where Silence Has Lease".	
fish-like alien	earth-life inspired life form	An alien race patterned after fish.	Worf considered the fish-like Antedeans to be "a handsome race" in tng2x19 "Manhunt"	
flatscreen TV	real gadget	A TV with an entirely flat screen. This was sci-fi back in the 60s.	Flint had a fancy flatscreen TV which he used for illicit surveillance of his guests in tos3x21 "Requiem for Methuselah". People did not have such devices when this episode was made so it constitutes sci fi.	https://en.wikipedia.org/wiki/Flat_panel_display
flattery	one-on-one interaction	Someone takes unusual pains to flatter someone else.	Berlinghoff Rasmussen nearly conned the Enteprise-D crew after putting them at ease with his silver tongue in tng5x09 "A Matter of Time".	https://en.wikipedia.org/wiki/Flattery
flee to fight another day	the art of war	Combatants decide to run from a battle in which they are at a disadvantage and holds that this is sensible rather than cowardice as it will allow them to fight again later.		
flirtation	romantic relationship	Playful and seductive manners are employed to subtly express romantic interests in a prospective partner.	Thadiun Okona, a self-described rogue, not so subtly expressed his romantic interest in Lt. B.G. Robinson in tng2x04 "The Outrageous Okona".	https://en.wikipedia.org/wiki/Flirting
floating city	mastering space	A city suspended in air by means of anti-gravitational technology.	The political elite on Ardana lived in a floating city named Stratos in tos3x19 "The Cloud Minders".	https://en.wikipedia.org/wiki/Floating_cities_and_islands_in_fiction
flying saucers	crackpot theory	The crackpot theory that flying saucers or other U.F.O.’s are sometimes sighted in the sky.	The 60s era Air Force pilot John Christopher sighted the Enterprise in low Earth orbit in tos1x21 "Tomorrow is Yesterday".	https://en.wikipedia.org/wiki/Unidentified_flying_object, http://www.sf-encyclopedia.com/entry/ufos
food synthesizer	fictional apparatus	A contraption used to produce any of a vast library of tasty meals and foods.		https://en.wikipedia.org/wiki/Replicator_(Star_Trek)
for better or for worse	romantic relationship	Two lovers stick together in spite of significant challenges to their relationship.		
forbidden love	romantic love	The love between two people who can't be together because society deems their relationship unnatural.		http://tvtropes.org/pmwiki/discussion.php?id=59jot0kdjvb4warku9qy2jwe
force field	fictional apparatus	Technology used to produce a (more or less) invisible and impenetrable wall of "force".		
force majeure existential risk	existential risk	The category of themes that suggest ways in which life on Earth (or some inhabited planet) could end because of essentially natural events that we do not control and may have little hope of preventing. When will the sun explode?		
forced resettlement	human rights	We are made to ponder when, if ever, it can be morally justified to coerce someone into moving away from where they have long lived.	The Federation sough to resettle the Native Americans of Dorvan V in order to honor a treaty in tng7x20 "Journey's End".	https://en.wikipedia.org/wiki/Forced_displacement
forced sterilization	past and present moral controversy	We are asked when, if ever, it is acceptable to prescribe sterilization - typically in the context of crime (e.g. for sex offenders).	The Gidoneans conspicuously refused any kind of contraceptive solution in tos3x17 "The Mark of Gideon".	
fortitude	agreeable characteristic	Someone shows a capacity for putting up with hardship and pulling through in spite of it.		
fraternal love	familial love	The love of brother for brother is featured.		
fraud	contemporary social issue	The ramifications of legal fraud in society are explored.	Ardra conned an entire planet by pretending to be their Antichrist in tng4x13 "Devil's Due".	
free inquiry vs. obedience	social dichotomy	The social principle of being allowed to speak freely without fear of retribution is contrasted with the principle of being obedient to higher authorities and greater causes. Should we, for example, stop people from advertising medicines that experts believe to be fake?		
free love	way of life	Someone shares their love freely and (at least ostensibly) accepts that others do the same. This is as opposed to monogamy and being jealous about a partners love affairs.	The hedonistic Edo from the planet Rubicun III shared their love freely in tng1x08 "Justice".	https://en.wikipedia.org/wiki/Free_love
