Theme	Parent	Definition	Example	References
pulsar	what's out there	A rotating neutron star that emits a beam of electromagnetic radiation, like a lighthouse.		https://en.wikipedia.org/wiki/Pulsar
pure evil alien	mentally distinguished life form	An entity that is pure sadistic evil.	The slick of malevolent tar Armus was such a being in tng1x23 "Skin of Evil".	
purpose in life	the human condition	The category of themes that are about what drives us and makes us act with what we perceive as "purpose". These are themes about our aspirations and needs, pleasures and cherished beliefs.		
pursuing one's dream vs. advancing one's career	life choice	A character must decide what is more important to them: their career or some other personal ambition such as galavanting around the universe.	Picard was mightily tempted to leave his post as captain of the Enterprise-D in tng6x20 "The Chase" to do space archaeology with his old mentor Professor Richard Galen.	
pursuing one's dream vs. saving a friend	life choice	A character must decide what is more important to them: a friends well being or their own  goals and aspirations.	Wesley had the stark choice of leaving to join Starfleet Academy or staying and saving his friends in tng3x24 "Ménage à Troi".	
putting differences aside	one-on-one interaction	Two characters agree to put past differences aside in order to pursue some more important joint purpose.		
quacksalvery	superstition	The fradulent practice of peddling unproven "medicines" that are highly unlikely to work as advertised.		https://en.wikipedia.org/wiki/Quackery
quasar	what's out there	Essentially a supermassive black hole that emits enormous amounts of electromagnetic energy.	The Enterprise encountered Murasaki 312, a quasar-like phenomena, in tos1x13 "The Galileo Seven". Interestingly, "murasaki" means purple in Japanese, yet the quasar was plainly green.	https://en.wikipedia.org/wiki/Quasar
queen and cache of eggs	familial relations	The relationship between a queen of an egg-laying species and her cache of eggs is featured.	The silicon based Horta was, like a queen bee, protective of her cache of eggs in tos1x26 "The Devil in the Dark".	
questioning one's sanity	introspection	Someone questions whether their beliefs are really rational.		
racism in society	prejudice in society	The issue of a large portion of society having an irrational, hostile, prejudice against people of a certain ethnicity, i.e., race, is discussed.		https://en.wikipedia.org/wiki/Racism, http://www.infobasepublishing.com/Bookdetail.aspx?ISBN=0816071616
radioactive space garbage scow	extraterrestrial threat	Someone else’s unwanted trash in outer space collides with your planet, pollutes it with radiation and suchlike, and everyone dies.	Such a monstrosity orbited the planet Gamelan V in tng4x09 "Final Mission" and subjected the inhabitants to critical levels of radiation.	
rage	unpleasant emotion	Someone is experiences "anger" to the extent that they are about to loose control and start smashing teeth or tables.	Enraged, Worf smashed Geordi’s mandolin to smithereens in tng4x20 "Qpid".	
randomization	topic in science	The practice of thoroughly mixing up a collection of objects so that nobody can tell which is which, like the use of a well-shuffled deck of playing cards at the fizzbin table (c.f. tos2x20 "A Piece of the Action").	Worf tacitly questioned Data’s randomization of a deck of cards in tng5x18 "Cause and Effect".	https://en.wikipedia.org/wiki/Randomization
rapid aging	human enhancement	A hypothetical process that makes you age significantly faster than normal and faster than natural.	When Gamma Hydra IV experienced mild radiation in the tail of a rogue comet, Captain Kirk and some of his team started to age rapidly in tos2x11 "The Deadly Years".	
rationalization of a belief	introspection	Someone strains to find arguments to support a cherished belief while irrationally overlooking potential counterarguments.		
real gadget	novel sci-fi concept	Star Trek is more than half a century old; this is the category of themes that features technology which is now real though it was near enough sci-fi at the time of the making.		
recapitulation theory	discredited scientific theory	A largely discredited hypothesis advanced by Ernst Haeckel that in developing from embryo to adult, animals pass through stages resembling successive stages in the evolution of remote ancestors.		https://en.wikipedia.org/wiki/Recapitulation_theory
reclusiveness	disagreeable characteristic	Someone takes pains to avoid the company of other people. Note: This is used for individuals and not for, say, a xenophobic alien species.	It was revealed that Tam Elbrun lived among the non-humanoid, telepathic Chandrans in order to avoid contact with other humanoids in tng3x20 "Tin Man".	https://en.wikipedia.org/wiki/Recluse
reconciliation	one-on-one interaction	Two people who have quarrelled in the past come to a more or less amicable reconciliation.	Riker and his father Kyle reconciled their differences over a heated anbo-jyutsu match in tng2x14 "The Icarus Factor".	https://en.wiktionary.org/wiki/reconciliation
reconciliation between two peoples	diplomacy	Two factions who have been at odds with each other decide to put their difference aside and seek rapprochement.		
red giant	what's out there	A luminous giant star in a late phase of stellar evolution.	The astrophysicist Paul Stubbs was aboard the Enterprise-D to observe a red giant explode in tng3x01 "Evolution".	https://en.wikipedia.org/wiki/Red_giant
relentless enemy	war	A people is threatened by an enemy who uncompromisingly wants them all dead and who will not be reasoned with.		
reliance on a central computer	man-made existential risk	People come to rely on a single central computer, but it crashes and everyone dies. That’s a real "blue screen of death".	The Bynar’s central computer was knocked out by an electromagnetic pulse in tng1x15 "11001001" and they nearly perished.	
reliance on a single point of failure is unwise	life lesson	The reasons for why you shouldn’t put all your eggs in one basket is illustrated.		
religion as a control mechanism	social order	There is a society in which the ruling elite moulds religious doctrine to justify their own position and exert control.		
religious fanaticism	contemporary social issue	The ramifications of religious fanaticism in society are explored.		
religious fervor	state of mind	Someone exhibits an obsessive enthusiasm related to their religion.	Worf encountered zealous Klingons who resurrected their Messiah in tng6x23 "Rightful Heir".	
remembrance	introspection	Someone reflects on memories of a departed loved one, friend, or colleague, etc.		
reminiscence	introspection	Someone looks back with emotion on previous experiences.		
remorse	unpleasant emotion	Someone feels regret for a past action that they have come to see as morally wrong, or for a mistake they should have been able to avert.		https://en.wikipedia.org/wiki/Remorse, http://www.infobasepublishing.com/Bookdetail.aspx?ISBN=0816071616
remote controlled humanoid	human enhancement	Technology by which, e.g., a human can be controlled by another human at a distance.	McCoy jury-rigged a brainless Spock so that he could be operated by remote control in tos3x06 "Spock's Brain".	
repressing one's hatred	introspection	Someone acknowledges their instinctive dislike of someone else, but strives not to become hate filled.	Puny Alexander wisely put a lid on his feelings towards powerful Parmen in tos3x12 "Plato's Stepchildren".	
reptilian alien	earth-life inspired life form	An alien race patterned after reptiles.	Captain Kirk was pitted in a fight to the death against a reptilian alien in tos1x19 "The Arena".	
resentment	antagonistic disposition	Someone harbors a resentment toward another stemming from a belief that he or she has been wronged by that person.		https://en.wikipedia.org/wiki/Resentment
resettlement vs. fighting for one's homeland	life choice	A character must decide whether it is worth it to stay and fight for their homeland when powerful authorities want their way with it.		
resisting a temptation	facing general adversity	Someone is tempted to do or indulge in something that they know they shouldn’t.	Captain Picard resisted the temptation to sleep with the empathic metamorph Kamala in tng5x21 "The Perfect Mate".	
respect for an enemy	amicable disposition	Someone exhibits feelings of admiration toward an enemy owing to their abilities or achievements.		
resurrection of the dead	religion	A person is brought back to life by miraculous means, as opposed to by the application of technology.	Worf was brought back from dead by the amnesiac alien provisionally named John Doe in tng3x25 "Transfigurations".	https://en.wikipedia.org/wiki/Resurrection
retarded aging	human enhancement	A hypothetical process that makes you age much slower than normal.	McCoy's tricorder scans of the Vaalians in tos2x09 "The Apple" revealed them to not be aging at all, praise be Vaal.	
reunion with a long lost son	parenting	A parent is reunited with their son after a very long time apart.		
reunion with a loved one	romantic relationship	Two lovers are reunited after a significant time apart.		
reverse psychology	one-on-one interaction	Someone employs reverse psychology to influence another in a desired way.	Data attempted a clever bit of reverse psychology on the stubborn colonists of Tau Cygna V in tng3x02 "The Ensigns of Command" but to no avail.	https://en.wikipedia.org/wiki/Reverse_psychology
reverse universe	what's out there	A hypothetical universe where black stars shine in a white void, etc.	The Enterprise got sucked into just such a universe in tas2x06 "The Counter-Clock Incident".	
reversed Newtonian mechanics	alternate laws of nature	A fantasy world where the basic physical laws of everyday life operate in reverse.	The use of reverse thrust propelled the Enteprise forward inside a mysterious "zone of darkness" in tos2x19 "The Immunity Syndrome".	
reversed time	alternate laws of nature	A fantasy world where time runs in reverse, e.g., people are born old and die young.	The Enterprise got sucked into just such a universe in tas2x06 "The Counter-Clock Incident".	
rhetoric	the fine arts and the humanities	The art of speaking to a group of people is featured.	Data tried every rhetorical trick in the book on the stubborn colonists of Tau Cygna V the in tng3x02 "The Ensigns of Command", but they insisted they’d rather stay and die fighting the Sheliak.	https://en.wikipedia.org/wiki/Rhetoric
righteousness	disagreeable characteristic	Someone makes themselves out to be morally better than others.	Lokai (the half white and half black Native of Cheron) portrayed himself as being morally better than his hated enemy Bele (the half black and half white Native of Cheron) in tos3x15 "Let that be your Last Battlefield".	
rise in ambient galactic radiation level	force majeure existential risk	The ever-present background radiation in a galaxy suddenly rises and everyone dies of radiation poisoning.	The Kelvan Empire was imperiled by a rise in ambient radiation across the Andromeda galaxy in tos2x21 "By Any Other Name".	
rise of the machines	man-made existential risk	People construct clever machines but the machines become too clever and decide to kill everyone. They won’t be back.		http://tvtropes.org/pmwiki/pmwiki.php/Main/RobotWar
risk taking vs. playing it safe	personal practical dilemma	Someone must decide, in a given situation, which course of action is the better: the risky one with (perhaps) a high reward or the relatively safe one that has but small reward.		
ritualistic communication	problem of language and meaning	A way of communicating through rituals that involve more than merely talking is illustrated.	To communicate with the Jarada in tng1x12 "The Big Goodbye", Captain Picard had to memorize a long and complicated ritual greeting.	
rivalry	one-on-one interaction	Two characters are rivals over, for example, a desired mate or workplace prestige.		
robot helper	AI technology	A sophisticated but not quite sentient mobile machine that serves man as his helper.	The immortal Mr. Flint had a hovering robot helped named M-4 in tos3x21 "Requiem for Methuselah".	
rogue comet	what's out there	A comet that is not gravitationally bound to a star.	The tail of a rogue comet passing over Gamma Hydra IV in tos2x11 "The Deadly Years" caused Captain Kirk and some of his team to age rapidly.	https://en.wikipedia.org/wiki/Rogue_planet
rogue planet	what's out there	A planet that is not gravitationally bound to a star.	General Trelane (retired) was found to live on a rogue planet in the middle of a "star desert" in tos1x18 "The Squire of Gothos".	https://en.wikipedia.org/wiki/Rogue_planet
role models	growing up	A young person imitates someone they look up to.		https://en.wikipedia.org/wiki/Role_model
romantic love	love	The category of themes that pertain to that peculiar sort of love between people so often associated with sexual attraction.		https://en.wikipedia.org/wiki/Romance_(love)
romantic relationship	one-on-one interaction	Two life-forms (usually a man or man-like alien hunk with a woman or a woman-like alien babe) engage in a romantic relationship.		https://en.wikipedia.org/wiki/Romance_(love)
rudeness	disagreeable characteristic	Someone is impolite or rude to others.	Wesley was flat out rude to Geordi in tng7x20 "Journey's End".	
rule by strength of arm	social order	There is a military strongman that holds political power on account of their ability to forcibly repress any opposition.		
ruthlessness	disagreeable characteristic	Someone pursues their objectives without taking pity on others.	Arctus Baran used pain implants to control the crew of his mercenary vessel in tng7x04 "The Gambit, Part I" and tng7x05 "The Gambit, Part II".	
sacrifice for a friend	self-sacrifice	Someone does a self-sacrificial thing for the sake of a friend.		
sacrifice for a loved one	self-sacrifice	Someone does a self-sacrificial thing for the sake of a person they love, i.e., a family member or a lover.		
sacrifice for a subordinate	self-sacrifice	Someone does a self-sacrificial thing for the sake of a person that is under their command at work or in the military.	Captain Kirk saved Uhura from a savage whipping by taking her place in tos2x17 "The Gamesters of Triskelion", perhaps anticipating the chance to pose bloodied and defiant in a savagely torn shirt.	
sacrifice for an adversary	self-sacrifice	Someone does a self-sacrificial thing for the sake of someone who is an opponent or even an enemy.		
sacrifice for an obsession	self-sacrifice	Someone does a self-sacrificial thing for the sake of an idea they are strangely obsessed by.	Matt Decker gave his life piloting a shuttlecraft clear into the maw of a planet eating machine in an effort to destroy it in tos2x06 "The Doomsday Machine".	
sacrifice for one's beliefs	self-sacrifice	Someone does a self-sacrificial thing for the sake of a cause they believe in.		
sacrifice for one's people	self-sacrifice	Someone does a self-sacrificial thing for the sake of the people they belong to, i.e., their tribe, country, ethnic group, etc.		
sacrifice self and crew to foil an enemy	self-sacrifice	The captain of a crew decides to sacrifice them all an self, in order to deny an enemy satisfaction.	Captain Picard was ready to destroy the Enterprise-D, himself and the crew with it, rather than give in to Nagilum in tng2x02 "Where Silence Has Lease".	
sacrificing a friend to save one's self	personal ethical dilemma	Someone must choose whether to accept their own demise, typically death or capture, or whether to callously sacrifice a friend to save themself.	Captain Kirk decided to maroon his old friend Gary on an uninhabited planet after Gary developed dangerous psychic abilities in tos1x01 "Where No Man Has Gone Before".	
sacrificing one's self for the universe	self-sacrifice	Someone does a self-sacrificial thing for the sake of the entire universe.	Lazarus-A selflessly committed to battling his deranged anti-matter duplicate Lazarus-B forever in limbo to stop him from destroying the universe in tos1x20 "The Alternative Factor".	
sacrificing one's self to contain a pandemic	self-sacrifice	Someone does a self-sacrificial thing in order to contain a highly infectious disease.	Spock sacrificed his eyesight in order to defeat the neural parasites in tos1x29 "Operation -- Annihilate!", though it turned out he had second eyelids that in fact saved him.	
sadism	disagreeable characteristic	Someone enjoys inflicting physical pain.	Gul Madred subjected Captain Picard to a host of  sadistic tortures in tng6x11 "Chain of Command, Part II".	
sadness	unpleasant emotion	Someoner feels a degree of sorrow for one reason or another that borders between "pensiveness" and outright "grief".	The Enteprise crew was saddened to learn that McCoy had been diagnosed with xenopolycythemia, a rare and terminal illness, in tos3x10 "For the World is Hollow and I Have Touched the Sky".	https://en.wikipedia.org/wiki/Sadness
saving a friend vs. self-preservation	personal ethical dilemma	Someone must choose between their own life and the life of a friend.		
saving a people vs. self-preservation	personal ethical dilemma	Someone must choose between saving an entire people on one hand, and saving their own skin on the other.		
saving innocent lives vs. compromising one's ethical principles	personal ethical dilemma	Someone must choose whether or not to commit unsavory acts in order to save innocent people.	Riker could have saved mining colonists and a dead child with his new Q-powers in tng1x10 "Hide and Q" if he had broken his word to Picard.	
science as magic to the primitive	views and customs	It is illustrated how people of a less advanced culture may perceive the science and technology of a more advanced culture as being, for all intents and purposes, magic. It is something outside the primitives’ understanding of the world.		https://en.wikipedia.org/wiki/Clarke%27s_three_laws
science for war or peace	social ethical dilemma	The following dilemma is illustrated: Should we pursue scientific research that has promising beneficial applications (cheap energy) if it has potentially devastating military applications (nuclear weapons)?	The pros and cons of science that creates super soldiers was discussed in tos1x24 "Space Seed".	
scientific discipline	modern science	The category of common contemporary scientific disciplines such as, for example, "physics" and "biology".		
scorched earth	the art of war	Combatants destroy their own resources to prevent an enemy from using them.	Klingons ignited the atmosphere on Indri VIII and destroyed all biological life there in tng6x20 "The Chase" to prevent others from collecting DNA samples.	https://en.wikipedia.org/wiki/Scorched_earth
sculpture	the fine arts and the humanities	The art of shaping materials is featured.	Data sculpted a treble clef at breakneck speed in tng7x17 "Masks".	https://en.wikipedia.org/wiki/Sculpture
seance	superstition	The idea that a trained mystic can help us communicate with the dead.	Prefect Jaris of Argelius II figured that this with be a good way to resolve the murder case brought against Scotty in tos2x07 "Wolf in the Fold".	https://en.wikipedia.org/wiki/S%C3%A9ance
searchable electronic database	real gadget	A computerized database that is readily searchable. This was avant garde technology in the 60s when people still spent inordinate amounts of time cross-referencing information manually using filing cabinets and indexing cards.		https://en.wikipedia.org/wiki/Database
second guessing a superior	one-on-one interaction	A subordinate questions the propriety of their superior’s decision.		
second guessing one's self	introspection	Someone questions the propriety of their own previously held beliefs or past actions.	Kevin Uxbridge second guessed himself over having wiped the Husnock race clean out of existence in tng3x03 "The Survivors".	
secret military base building	the art of war	One faction covertly builds a military base in a location that is strategically sensitive to an opposing faction.	Captain Maxwell did not take well to Cardassian attempts at building a secret base near Federation territory in tng4x12 "The Wounded".	https://en.wikipedia.org/wiki/Secrecy#Military_secrecy
security vs. freedom	social dichotomy	The typically desirable quality of safety and security in society is contraposed with the typically desirable quality of individual freedom. Should we, for example, limit freedom of the press in order not to provoke terrorism?	The Rutians had given up much liberty to gain but little security for the sake of fighting terrorism in tng3x12 "The High Ground".	
seeing the error of one's ways	introspection	Someone comes to realize that their previous actions and attitude were in fact bad.		
selective memory	state of mind	Someone seems to remember only those things that it suits their interests to remember.	Each person remembered events much as they preferred it to have been in the little murder drama of tng3x14 "A Matter of Perspective".	
self-analysis	introspection	Someone tries to put pretension aside and sort out what they truly think and feel.		
self-confidence	introspection	Someone ponders whether they are really capable enough to do what they do, intend to do, are requested to do, etc.	Wesley was assigned to lead a science team in an effort to help build his self-confidence in tng2x15 "Pen Pals".	https://en.wikipedia.org/wiki/Self-confidence
self-deception	introspection	Someone refuses to face uncomfortable truths.		https://en.wikipedia.org/wiki/Self-deception
self-destruct tactic	the art of war	Combatants decide to destroy themselves and their vessel rather than to surrender, and perhaps in order to kill their opponents with themselves.		
self-image	introspection	Someone thinks about how they see themselves in contrast with how other people may see them.		https://en.wikipedia.org/wiki/Self-image
self-replicating nano-devices	fictional apparatus	The potential consequences of introducing small man-made self-replicating devices is explored.	Wesley created such things in tng3x01 "Evolution".	
self-sacrifice	facing adversity	The category of themes that are about someone helping another at a significant cost or risk to themself.		
selfless service	self-sacrifice	Someone does a self-sacrificial thing in the line of duty but above and beyond the call of duty.		
semantic progression	problem of language and meaning	The way that words and sounds tend to change meaning over the course of history is illustrated.	An Abraham Lincoln replica asked forgiveness for calling Uhura  "a charming negress" in tos3x22 "The Savage Curtain" upon recalling that the term was used by some in his time as a description of property.	https://en.wikipedia.org/wiki/Semantic_change
sentient computer	AI technology	A computer-like machine that is self-aware an intelligent. This is used about stationary devices.		
sentient nanomachines	inorganic life form	Tiny artificial machines that are somehow sentient.	Wesley experimented with self replicating nanomachines that got loose aboard the Enterprise-D and evolved sentience in tng3x01 "Evolution".	
sentient rights	human rights	We are made to ponder what intrinsic rights we feel should be awarded all sentient beings even if they are nothing like humans in shape or temperament.		
sentient space probe	AI technology	An artificial self-aware object designed to explore space.	Nomad was such an object in tos2x08 "The Changeling", and hellbent on cleansing the universe of imperfect beings.	
serenity	pleasant emotion	A character exhibits a feeling of calm and contentment without the pleasure or happiness that come with the experience of "joy".		
sex-droid	AI technology	A "fully functional" android of one gender or another, designed to please its masters in matters of the flesh.		
sexism in society	the battle of the sexes	Prejudice against someone because of their gender is featured.		https://en.wikipedia.org/wiki/Sexism
sexual prejudice in society	prejudice in society	The issue of a large portion of society having a prejudice about a gender, e.g., believing that men are unfit to tend children, is discussed.	The generally gender neutral J’naii were prejudiced against both the male and the female sex in tng5x17 "The Outcast".	
shades of gray	views and customs	We are shown that moral questions are often not black and white but have many coherent and potentially valid viewpoints in between the extremes.		
shamanism	superstition	The ritualistic practice among tribal people of crediting supposed magicians with powers of healing, divination, and protection against bad magic conjured by others.	Captain Kirk was made a genuine space shaman after he lost his memories on the planet Amerind in tos3x03 "The Paradise Syndrome".	https://en.wikipedia.org/wiki/Shamanism
shame	unpleasant emotion	Someone feels bad because of past actions of theirs that they have come to think were wrong, or because they have an unbecoming outwards appearance.		https://en.wikipedia.org/wiki/Shame
shapeshifter	miscellaneous life form	A creature that can radically change its shape, seemingly by magic.		https://en.wikipedia.org/wiki/Shapeshifting, http://www.sf-encyclopedia.com/entry/shapeshifters
shapeshifting	human enhancement	A hypothetical process by which a human or other biological creature can change shape to a seemingly different kind of creature. This is often featured as an inate ability.		https://en.wikipedia.org/wiki/Shapeshifting, http://www.sf-encyclopedia.com/entry/shapeshifters
