Theme	Parent	Definition	Example	References
what if I couldn't trust the veracity of my senses	what if I faced an incredible situation	We imagine what it would be like if the world our senses reported on became so peculiar that we had to question our own senses and even our sanity.	Sulu couldn't tell whether those were swirling knives out there in space while at the held or whether his eyes were tricking him in tos3x05 "And the Children Shall Lead".	
what if my enemy and my ally looked exactly alike and I had to choose between them	what if I faced an incredible situation	We imagine what it would be like in this rather peculiar situation.	Incredibly, Spock faced exactly this situation when Garth of Izar transformed himself to look like Captain Kirk in tos3x16 "Whom Gods Destroy".	
what if my life were different	alternate life	The category of themes that centre around someone experiencing what it would be like if their life were different in some interesting and significant aspect. Many of these themes involve magic or seemingly magical phenomena.		
what if my partner suddenly became possessed by a demon	what if I faced an incredible situation	We imagine what it would be like if a loved one suddenly became possessed by a demon and started doing evil demon things, like hitting us.	Keiko O'Brien's husband Miles became possessed by a malevolent,  disembodied prisoner alien in tng5x15 "Power Play".	
what if our fantasies become reality	what if society were different	We imagine what the world would be like if every person’s random fantasies just became real as soon as they imagined them.	The Enterprise crew experienced this sort of alternate reality on the Shore Leave amusement park planet in tos1x17 "Shore Leave", and again in tas1x09 "Once Upon a Planet".	
what if society consisted of only children	what if society were different	We imagine what the world would be like if there were only children around.	Captain Kirk and his team found a planet on which all the adults had died from a mysterious disease while the children stayed children for hundreds of years in tos1x11 "Miri".	
what if society were different	alternate society	The category of alternate reality themes which imagine a society of humans or aliens that is different from what we normally experience in some interesting respect.		
what if the Nazis had won	what if society were different	We imagine what the world would be like if the Nazis had prevailed in World War II and come to world dominance.	The possible consequences of a Nazi victory in World War II were explored in tos1x28 "The City on the Edge of Forever".	http://www.sf-encyclopedia.com/entry/axis_wins
what if the Roman Empire never fell	what if society were different	We imagine what the world would be like if the Roman Empire had not declined from its peak but simply gone on to become globally dominant into modern times.	Our protagonists came across a planet which was virtually a parallel of Earth up until the 20th century, except that the Roman Empire had somehow survived in tos2x14 "Bread and Circuses".	
what if the devil was merely misunderstood	what if society were different	We imagine what the world would be like if the much despised Devil of Christian mythology was real yet not, in fact, evil but merely misunderstood.	The Devil was revealed to be  a well-intending but misunderstood alien in tas1x08 "The Magicks of Megas-Tu".	
what if we all lost our memories	what if society were different	We imagine what the world would be like if everyone suddenly lost all their memories.	The entire crew on the Enterprise suddenly lost their memories in tng5x14 "Conundrum", which led to much befuddled and amusing awkwardness.	
what is beauty	aesthetics	The question of what "beauty" really is is discussed. Why do we call some things "beautiful"?		https://en.wikipedia.org/wiki/Beauty
what is justice	ethics	The vary nature of what is just and what is unjust is discussed.		https://en.wikipedia.org/wiki/Justice
what is life	metaphysics	The slippery definition of what constitutes "life" is discussed. Nature has a way of befuddling biologists whenever they think they may have pinned it down, and sci-fi can of course speedily go beyond nature into the purely hypothetical.		https://en.wikipedia.org/wiki/Life
what is natural	metaphysics	The subtle question of what it means for something to be "natural" contra "unnatural" is discussed. For example: since most people die before reaching 90, is it unnatural to live longer than that? What about 100? 500?		
what is perfection	aesthetics	The question of what "perfection" really is, is discussed. Is there such a thing as true perfection?	The sentient space probe Nomadof  tos2x08 "The Changeling" set out to eradicate all imperfections in the universe, but Captain Kirk demonstrated to it that it was itself imperfect.	https://en.wikipedia.org/wiki/Perfection
what is ugly might still be good	life lesson	The age old observation that things which are ugly on the surface can yet be good and beautiful on the inside is featured.	The Medusans turned out to be rather nice chaps in spite of being so ugly that a mere glance of them would drive you insane in tos3x07 "Is There in Truth No Beauty?".	
what men want	male stereotype	The question of what men want out of life or out of prospective mates is discussed.	Scotty, for example, wanted a cabaret dancing girl in tos2x07 "Wolf in the Fold".	
what women want	female stereotype	What women in contemporary society tend to want out of life is discussed, typically with emphasis on things that men would be less concerned with.		
what's out there	novel sci-fi concept	The category of sci-fi themes that speculate about what we may find out there in the deepest depths of space: dark matter nebulas, quasars, wormholes and an entire parallel antimatter universe, perhaps?		
when in Rome	cross cultural understanding	The notion that when you are abroad it is best to adopt the customs of those around you, is featured.	Captain Kirk urged Scotty to refrain from applauding loudly in appreciation of a seductive belly dance at an Argelian cafe, directing the drunken engineer to blink the table light according to Argelian custom in tos2x07 "Wolf in the Fold".	
who is the aggressor	views and customs	We are shown that in armed conflict, it is often not at all clear who deserves to be labelled the aggressor in the larger view of things.		
witch hunt	religion	The religious practice, mostly Christian, of hunting down people that are believed to fraternize with the devil.	Captain Kirk was confined and nearly charged with witchcraft in tos3x23 "All Our Yesterdays".	https://en.wikipedia.org/wiki/Witch-hunt
withdrawal from society	state of mind	Someone isolates themselves from their family, friends, and or community.		
woman in charge	the battle of the sexes	The outlandish notion that a woman can be the leader of a group is featured.		
womanizing	romantic relationship	A man engages in numerous casual love affairs with different women.	Thadiun Okona flirted with every skirt in sight in tng2x04 "The Outrageous Okona".	
women as irrational bundles of conflicting impulses	female stereotype	A woman is featured in a manner suggestive of the stereotype that their sex is illogical.	The presumably genderless and disinterested space probe Nomad concluded that Uhura was a mass of conflicting impulses in tos2x08 "The Changeling".	
women's rights	human rights	We are made to ponder what rules need to be made in order for women to feel they have the same rights and opportunities as men in society.	The alien woman Kamala was born and raised for no other purpose than to be the perfect mate to an important foreign dignitary in tng5x21 "The Perfect Mate", but don’t women have more than that to offer human (or alien) kind?	https://en.wikipedia.org/wiki/Women%27s_rights
workers replaced by machines	past and present moral controversy	We are asked to what extent we should fear and, perhaps, oppose the replacement of workers by machines. The day when this definition is written by a computer may not be far off.	McCoy moaned about the M-5 multitronic unit (a computer) taking everyone’s jobs in tos2x24 "The Ultimate Computer".	
working parents	parenting	The many trials and tribulations involved in rearing a child while both parents work full-time jobs is featured.	Worf found it difficult to care for his son Alexander and make it to meetings on time in tng5x10 "New Ground".	https://en.wikipedia.org/wiki/Working_parent
working together in spite of disagreement	group interaction	People who disagree and dislike each other must seek to work together in spite of their differences.		
working together under stress	group interaction	People must try to work amicably and efficiently together under heavy stress.		
workplace relations	group interaction	People form friendships and other interpersonal relationships in the workplace.		
world eating machine	mastering space	An enormous machine that gobbles up entire planets for fuel.	An autonomous but not sentient machine nicknamed "The Planet Eater" from another galaxy came and gobbled up some planets and a Federation starship in tos2x06 "The Doomsday Machine".	
world eating space cloud	spaceborne life form	An animal-like being of enormous proportions but with internal components analogous those of a living creature, i.e., organs. The space amoeba is to a cell, as this thing is to an animal.	An enormous cloud like creature from another galaxy almost gobbled up a Federation colony in tas1x03 "One of Our Planets Is Missing".	
world with déjà vu	alternate laws of nature	A world where the naïve interpretation of the experience of déjà vu is the correct one.	Senior officers experienced déjà vu because the ship was stuck in a time loop in tng5x18 "Cause and Effect".	
world with telepathy	alternate laws of nature	A world where telepathy constitutes a part of the ordinary operation of natural laws.		https://en.wikipedia.org/wiki/Telepathy
wormhole	what's out there	A hypothetical passage through space-time that would allow vast distances to be quickly traversed.		
wrath	deadly sin	A character is overcome with inordinate and uncontrolled feelings of hatred and anger. In practice, this is used for hot-blooded fighting when it is featured as part of the story. Because fighting is common, the bar for calling it a "wrath" theme is quite high.	Worf flew into a violent rage in the aftermath of the murder of his on-again, off-again mate K'Ehleyr in tng4x07 "Reunion".	
xenocide vs. foregoing personal gain	personal ethical dilemma	Someone must choose whether or not to kill an entire sentient species to acquire wealth. Outlandish as this may sound, mankind has a long history of engaging in intellectual sophistry for the sake of personal gain; remember the North American slave trade.	The miners on Janus VI were faced with that eternal human ethical dilemma: to give up a lucrative source of wealth or kill off a race of intelligent beings, in tos1x26 "The Devil in the Dark".	
xenophobia in society	prejudice in society	The issue of a large portion of society having hostile and fearful attitudes toward strangers is discussed.		https://en.wikipedia.org/wiki/Xenophobia
xenophobic isolationist alien	culturally distinguished life form	An alien race that chooses to remain apart from the affairs of other aliens, perhaps out of fear of strangers.	The Paxans went to elaborate lengths to hide their home world in tng4x14 "Clues".	
you can't force someone to love you	life lesson	The time tested wisdom that, no matter how much you want it, you can’t force someone to love you.	Amanda used her Q powers to make Riker act as if he loved her in tng6x06 "True Q" but it wasn’t genuine love.	
you have to take chances to get ahead	life lesson	Someone takes great risks in order to gain an advantage in life.	Q offered Picard a second chance at life in which Picard choose to play everything safe in tng6x15 "Tapestry"; he ended up as the most dreary kind of person imaginable, a scientist, and speedily repented.	
young and old romance	romantic relationship	A younger person and an older person embark on a romantic relationship together, with all the troubles and tribulations that may entail.		
young lovers	romantic relationship	The mutual passion of two besotted young lovers is featured.		
youthful indiscretion	growing up	A juvenile does stupid or criminal things as juveniles so often do before they learn better.		
zoo making alien race	culturally distinguished life form	An alien race that maintains a zoo of other alien races’ members.	The Lactrans kept a zoo of strange aliens gathered from across the galaxy in tas1x15 "The Eye of the Beholder".	
über-belligerent alien	culturally distinguished life form	A race of aliens defined by their abnormally belligerent nature, prominently the Klingons.	The Klingon Worf smashed Geordi's mandolin to smithereens in tng4x20 "Qpid".	
to serve in haven vs. to reign in hell	personal ethical dilemma	Someone is confronted with option of either serving an insignificant role in a pleasant society, or being part of the elite in a less savory place.	Weyland to join him and reign instead of continuing his life as a servant.	
solar sail	starship technology	Massive sail-like sheets that can be folded an unfolded, and are used either to harness solar energy. The energy can be used directly as propulsion or indirectly by being stored as electricity.	The colony ship in Alien: Covenant (2017) solar sails to gather power intermittently.	
dysfunctional upbringing	growing up	Someone grows up in a family under conditions that professionals would probably describe as  dysfunctional. This typically involves some amount of psychological problems.		
there is nothing to fear but fear itself	life lesson	An age old adage which signifies that oftentimes, fear itself is the most dangerous thing we have to fear. Fear may make us do stupid things that break social bonds.	Pennywise in "It" (1990) manipulated people via their innermost fears.	
what if I saw strange things no one else could see	what if I faced an incredible situation	This fantastical situation is featured.		
children and candy from strangers	parenting	The parental injunction to steer clear of strangers that offer candy is featured.		
powered exoskeleton	real gadget	A machine that surrounds you and enhances your normal human movements.		https://en.wikipedia.org/wiki/Powered_exoskeleton
inebriated practitioner of medicine	medical ethics	What extent a Doctor may have an extra duty to retain a grip on his faculties while practicing medicine is discussed.		
what if I was super rich	what if my life were different	What would a normal person do with virtually unlimited money?		
the AI singularity	man-made existential risk	The idea that at some point AI will become more advanced than humans. Then they will  accelerate the development of even more advanced AI, and so on ad infinitum. The result will be completely unpredictable and may make humans obsolete in the wink of  an eye, goes the thinking.		https://en.wikipedia.org/wiki/Technological_singularity
the Turing test	topic in science	An idea famously suggested by Allan Turing that when AI can fool humans, they will indeed by intelligent.		https://en.wikipedia.org/wiki/Turing_test
coping with infertility	coping with an affliction	Someone struggles to come to term with the fact that they can't make babies of their own.		
automatic surgery machine	fictional apparatus	A non-sentient machine that can nonetheless perform surgery without human supervision.		https://en.wikipedia.org/wiki/Robot-assisted_surgery
actions have consequences	life lesson	Someone learns this valuable lesson.		
criminal gang in society	domestic social issue	There is a criminal gang and their influence on society is featured.		https://en.wikipedia.org/wiki/Gang
transnational institution for peace	diplomacy	An institution reminiscent of the UN is featured.		
reasons for war	war	The question of why wars happen is taken up.		
democracy	social order	The workings of a democracy are featured.		https://en.wikipedia.org/wiki/Democracy
people bread for organ donation	social ethical dilemma	We are asked to what extent, if any, it might be ethically acceptable to create human clones to harvest their organs.		
utopia on the back of human clones	utopia	Society is great because we can make clones to deal with problematic issues.		
knowledge is power	the art of war	The age old wisdom that having knowledge that others' lack can be a source of power to influence the actions of others, is featured.		
what if I found out my lover was despicable	what if I faced an incredible situation	Someone unexpectedly finds out something about their lover that is so despicable it makes continuing the relationship unthinkable.		
those who do not remember the past are condemned to relive it	life lesson	This time-tested piece of wisdom is demonstrated.		
religious toleration	social order	There is a society in which people with drastically different religious beliefs are  seen to treat each others with toleration.		https://en.wikipedia.org/wiki/Toleration
Nirvana	religion	The concept of Nirvana found in Hinduism, Buddhism etc. is featured.		https://en.wikipedia.org/wiki/Nirvana
fifth columns	contemporary social issue	Inside the governing institutions of society there is an organized group that more or less  clandestinely seeks to undermine and take control from within.		https://en.wikipedia.org/wiki/Fifth_column
healing after social upheaval	contemporary social issue	The story discusses how societies come to terms (or not) with what has happened after a great social upheaval such as was World War 2.		
religious evangelical vs. progressive	social dichotomy	We are asked whether society should be organized along the principles of religious evangelicals or modernist progressives when their respective ideologies are in contradiction.		
parents wishes vs. the good of the patient	medical ethics	We are asked to what extent a Doctor must respect the wishes of the parents of a minor when those wishes are seen as being against the good of the child.		
the need to know one's roots	human need	It suggested that people need to understand where they come from and who their nearest ancestors are in order to be content.		
handling of industrial accidents	contemporary social issue	The issue of how headline grabbing industrial accidents are handled is discussed.		
strikes in society	contemporary social issue	The feature of strike action among organized worker groups in society is discussed.		https://en.wikipedia.org/wiki/Strike_action
workers' rights	human rights	It is discussed what kind of rights we feel that lowly workers ought to have.		https://en.wikipedia.org/wiki/Labor_rights
negotiating deadlock	group interaction	Two or more people are in a process of negotiating but neither will budge from their entrenched position.		
the unappreciated and unimportant at the workplace	pecking order	The ungratifying experience of someone who is at the very bottom rung of the corporate ladder is featured.		
what it is like to be different	group interaction	The experiences of someone who is significantly different from everyone else in their surrounding  is featured. Someone might for example be an outcast because of their skin color.		
rearing a child with mental problems	parenting	Someone struggles to bring up a child who has serious mental problems, such as ADHD or mood disorders.		
what if society split into more than one distinct race	what if society were different	We imagine what it would be like if there were at least two variants of humans who were genetically different to the point of constituting different races. They might not necessarily recognize each other as equally human.		
femme fatale	female stereotype	There is a seductive female character who ensnares a lover and uses them for her own ends, often with danger involved.		https://en.wikipedia.org/wiki/Femme_fatale
self-control	introspection	A character reflects on having lost self-control and acted on base emotions such as fear or anger, etc.		https://en.wikipedia.org/wiki/Self-control
AI safeguards	AI technology	Ways in which AI can be made safe from becoming kill-all-human machines are discussed. Isaac Asimov's three laws of robotics are a popular example.		https://en.wikipedia.org/wiki/Artificial_intelligence
DNA testing	topic in technology	Methods by which DNA can be examined are featured. They may, for example, be used to compare people or identify genetic predispositions.		https://en.wikipedia.org/wiki/Genetic_testing
Leonardo da Vinci	history	The well known historical character Leonardo da Vinci is featured, directly or through his works.		https://en.wikipedia.org/wiki/Leonardo_da_Vinci, http://www.sf-encyclopedia.com/entry/leonardo_da_vinci
Morse code	topic in technology	An historically important method of encoding the alphabet into binary sequences of long and short signals,  often audible beeps.		https://en.wikipedia.org/wiki/Morse_code
SETI	topic in science	A contemporary scientific endeavor to search for extraterrestrial intelligence, primarily by employing  powerful telescopes of different kinds and analyzing the received signals.		https://en.wikipedia.org/wiki/Search_for_extraterrestrial_intelligence, http://www.sf-encyclopedia.com/entry/seti
a common enemy unites	human nature	The tendency humans have of putting differences aside and collaborating when a common enemy appears  is featured.		
a common interest unites	human nature	The tendency humans have of putting differences aside and collaborating when something of mutual interest appears is featured.		
a leopard can't change its spots	human nature	The human fact that it is often hard or impossible to change such habits as are long ingrained or  inborn, is featured.		https://www.merriam-webster.com/dictionary/a%20leopard%20can't%20change%20its%20spots
accidental alien destruction of planetary ecosystem	extraterrestrial threat	Otherwise well-meaning aliens inadvertently affect a planets eco-system in a very negative way, for  example by introducing alien pathogens that it cannot cope with, and civilization collapses.		
alien origin of near-death experiences	crackpot theory	The crackpot notion that aliens are somehow behind the various weird things people may experience when they are on the brink of death.		
anarchist utopia	utopia	Society is perfect when there are no pesky laws and governments to prevent us from pursuing our dreams.		
anarchy vs. rule of law	social dichotomy	An anarchist philosophy of life is contrasted with a philosophy of life that emphasizes law and order.  Anarchist usually means a distaste or disregard for rules.		
anger management	introspection	Someone struggles consciously to handle their inner anger.		
anger management issues	introspection	Someone struggles consciously to handle their inner anger.		https://en.wikipedia.org/wiki/Anger_management
animal guide	superstition	The shamanistic belief in spirit animal guides is featured.		https://en.wikipedia.org/wiki/Totem
ankle bracelet	real gadget	A device used to control prisoners.		https://en.wikipedia.org/wiki/Ankle_monitor
anti-science in society	past and present moral controversy	The opposition between adherents of a scientific way of thinking with people who  feel threatened by it is discussed.		https://en.wikipedia.org/wiki/Antiscience
antigovernment militia movement	contemporary social issue	A militant rebel movement that strives to overthrow the sitting government is featured.		https://en.wikipedia.org/wiki/Militia_organizations_in_the_United_States
artificial lungs	human enhancement	Artificially created human lungs.		https://en.wikipedia.org/wiki/Artificial_lung
astronomy	scientific discipline	The scientific discipline of astronomy, the study of celestial objects and phenomena, is highlighted.		https://en.wikipedia.org/wiki/Astronomy
autonomous sentient coworker	AI technology	An artificial co-worker, for example a robot, that is autonomous and sentient.		
bad influence on children	parenting	A parent's concern for the bad influence someone may have on their child is noted.		
being ashamed of who you are	introspection	Someone thinks about why the feel ashamed for who they are.		
bellicosity	disagreeable characteristic	Someone is aggressive and hostile.		
bioengineered human suicide-weapon	human enhancement	Technology used to turn someone into a living walking bomb, for example.		
biological computer virus	what's out there	A virus that is more like real viruses than computer viruses but infects biological  components of a biological computer.		
biological spaceship	starship technology	A spaceship made up of biological components, i.e., cells and such.		https://en.wikipedia.org/wiki/Bioship
brain memory virus	parasitic life form	A viral life form that embeds itself in the memory parts of the brain of a host.		
bribery in society	contemporary social issue	The social problem of people taking bribes is discussed.		https://en.wikipedia.org/wiki/Bribery
burning the candle at both ends	group interaction	Someone is working longer and harder than what they can really cope with.		https://en.wiktionary.org/wiki/burn_one%27s_candle_at_both_ends
career choice	life choice	Someone is confronted with the consequential tough decision of which path to pursue in the  development of their career.		
childhood terrors	growing up	A child is afraid of something that adults normally know better than to fear, for example  monsters in the dark or the bogeyman.		
choosing between conflicting loyalties	personal ethical dilemma	A character has a bond of loyalty tying them to two different people or factions, but these come into conflict and the character must choose one in order not to betray both.	In voy3x06 "Remember", B'Elanna had an alien inspired dream in which she had to choose between saving her lover's life on one hand, and being obedient to her parents on the other.	
